{
  "schemaVersion": "4.2",
  "validatorVersion": "4.2.1",
  "placeId": "smestad_gjenvinningsstasjon",
  "placeFile": "data/places/natur/oslo/miljo_gjenbruk/smestad_gjenvinningsstasjon.json",
  "status": "ready_v4_2",
  "identity": {
    "status": "resolved",
    "represents": "Smestad gjenvinningsstasjon som eget kommunalt ombruks- eller gjenvinningstilbud ved Ullernchausseen 26, 0379 Oslo.",
    "period": "2026–",
    "excludes": [
      "andre kommunale gjenvinningsstasjoner",
      "mobile eller midlertidige tilbud",
      "nabosteder uten samme tjenesteidentitet"
    ]
  },
  "metadataSnapshot": {
    "name": "Smestad gjenvinningsstasjon",
    "category": "natur"
  },
  "textHashes": {
    "algorithm": "sha256",
    "desc": "504c1f5b145c850377681d7e284708dfc2a8976eceff7d56145fffa7d0b7d82a",
    "popupDesc": "9a8675b90d4db97f78673ab93c2bb31bb11516cf0543ea4f7faba58cde0b6f5e"
  },
  "claims": [
    {
      "id": "claim_smestad_gjenvinningsstasjon_identity",
      "claim": "Smestad gjenvinningsstasjon er Oslo kommunes aktive ombruks- eller gjenvinningstilbud ved Ullernchausseen 26, 0379 Oslo.",
      "sourceUrl": "https://www.oslo.kommune.no/avfall-og-gjenvinning/alle-gjenvinningsstasjoner/smestad-gjenvinningsstasjon/",
      "sourceLocation": "Kommunal stedsside: navn, plassering og tjeneste.",
      "sourceType": "institutional",
      "verifiedAt": "2026-08-26",
      "status": "verified",
      "claimKind": "identity",
      "evidenceMode": "direct",
      "temporalStatus": "current"
    },
    {
      "id": "claim_smestad_gjenvinningsstasjon_reuse",
      "claim": "Byggevarer kan hentes gratis fra kommunens ombruksløsning inne på stasjonen.",
      "sourceUrl": "https://www.oslo.kommune.no/avfall-og-gjenvinning/alle-gjenvinningsstasjoner/smestad-gjenvinningsstasjon/",
      "sourceLocation": "Kommunal stedsside og ombruksside: uttak, salg og praktisk ombruksfunksjon.",
      "sourceType": "institutional",
      "verifiedAt": "2026-08-26",
      "status": "verified",
      "claimKind": "ordinary",
      "evidenceMode": "direct",
      "temporalStatus": "current"
    },
    {
      "id": "claim_smestad_gjenvinningsstasjon_network",
      "claim": "Smestad gjenvinningsstasjon er del av kommunens ombruks- og gjenvinningsnettverk i Oslo.",
      "sourceUrl": "https://www.oslo.kommune.no/avfall-og-gjenvinning/ombruk/",
      "sourceLocation": "Hente eller levere til ombruk: uttakssteder og ombruksløsninger.",
      "sourceType": "institutional",
      "verifiedAt": "2026-08-26",
      "status": "verified",
      "claimKind": "ordinary",
      "evidenceMode": "direct",
      "temporalStatus": "current"
    },
    {
      "id": "claim_smestad_gjenvinningsstasjon_access",
      "claim": "Praktiske vilkår og tilgjengelighet ved Smestad gjenvinningsstasjon kan endres og må kontrolleres på den kommunale stedssiden.",
      "sourceUrl": "https://www.oslo.kommune.no/avfall-og-gjenvinning/alle-gjenvinningsstasjoner/smestad-gjenvinningsstasjon/",
      "sourceLocation": "Kommunal stedsside: praktiske vilkår og aktuell tilgjengelighet.",
      "sourceType": "institutional",
      "verifiedAt": "2026-08-26",
      "status": "verified",
      "claimKind": "temporal",
      "evidenceMode": "direct",
      "temporalStatus": "current"
    },
    {
      "id": "claim_smestad_gjenvinningsstasjon_circular",
      "claim": "Ombruksfunksjonen ved Smestad gjenvinningsstasjon viser avfallshierarkiets prioritering av videre bruk før materialgjenvinning når det er forsvarlig.",
      "sourceUrl": "https://www.miljodirektoratet.no/ansvarsomrader/avfall/sirkular-okonomi/",
      "sourceLocation": "Miljødirektoratets fagstoff om sirkulær økonomi og avfallshierarki.",
      "sourceType": "official",
      "verifiedAt": "2026-08-26",
      "status": "verified",
      "claimKind": "ordinary",
      "evidenceMode": "direct",
      "temporalStatus": "current"
    }
  ],
  "sentenceCoverage": {
    "desc": [
      {
        "sentence": 1,
        "claimIds": [
          "claim_smestad_gjenvinningsstasjon_identity"
        ]
      },
      {
        "sentence": 2,
        "claimIds": [
          "claim_smestad_gjenvinningsstasjon_reuse"
        ]
      },
      {
        "sentence": 3,
        "claimIds": [
          "claim_smestad_gjenvinningsstasjon_network"
        ]
      }
    ],
    "popupDesc": [
      {
        "sentence": 1,
        "claimIds": [
          "claim_smestad_gjenvinningsstasjon_identity"
        ]
      },
      {
        "sentence": 2,
        "claimIds": [
          "claim_smestad_gjenvinningsstasjon_reuse"
        ]
      },
      {
        "sentence": 3,
        "claimIds": [
          "claim_smestad_gjenvinningsstasjon_access"
        ]
      },
      {
        "sentence": 4,
        "claimIds": [
          "claim_smestad_gjenvinningsstasjon_circular"
        ]
      }
    ]
  },
  "reviews": {
    "factual": {
      "status": "passed",
      "reviewedAt": "2026-08-26",
      "reviewer": "History GO independent source and place-specificity audit"
    },
    "editorial": {
      "status": "passed",
      "reviewedAt": "2026-08-26",
      "reviewer": "History GO independent source and place-specificity audit",
      "introducedNewFacts": false
    }
  },
  "quizReadiness": {
    "questions": []
  },
  "completion": {
    "completedUnder": "4.2",
    "currentStatus": "current",
    "sourceVerifiedAt": "2026-08-26",
    "claimsVerified": {
      "verified": 5,
      "total": 5
    },
    "factualReview": "passed",
    "editorialReview": "passed",
    "validatorVersion": "4.2.1"
  }
}
