{
  "schemaVersion": "4.2",
  "validatorVersion": "4.2.1",
  "placeId": "kristiansand",
  "placeFile": "data/places/by/agder/kristiansand/kristiansand.json",
  "status": "needs_research",
  "identity": {
    "status": "resolved",
    "represents": "Kristiansand som canonical område-Place for den dokumenterte lokale Språkatlas-profilen, avgrenset fra enkeltbygninger og fra en hard dialektgrense.",
    "period": "nåtid",
    "excludes": [
      "hele Kristiansand kommune når den er geografisk større enn det valgte områdeankeret",
      "enkeltbygninger, institusjoner og kulturminner med egne Place-identiteter",
      "dialektområdet som en hard geografisk grense"
    ]
  },
  "metadataSnapshot": {
    "name": "Kristiansand",
    "category": "by",
    "period": "nåtid",
    "coordinates": {
      "lat": 58.14615,
      "lon": 7.9957333
    }
  },
  "textHashes": {
    "algorithm": "sha256",
    "desc": "04918783001b02f5153135f83b1667bb0d280e1a8aedbe48a44b41af2edf12ec",
    "popupDesc": "0ab36676d58d36563ce784e05c7c4d879903753e182476b256e782512e7f6586"
  },
  "claims": [
    {
      "id": "claim_kristiansand_1",
      "claim": "Kristiansand er et tettsted og byområde i Kristiansand kommune i Agder, mens kommunen også omfatter andre tettsteder og store områder utenfor den sammenhengende bybebyggelsen.",
      "sourceUrl": "https://snl.no/Kristiansand",
      "sourceLocation": "Faktaboks, ingress og avsnitt om bosetning",
      "sourceType": "reputable_secondary",
      "verifiedAt": "2026-08-19",
      "status": "verified",
      "claimKind": "identity",
      "evidenceMode": "explicit"
    },
    {
      "id": "claim_kristiansand_2",
      "claim": "SSBs avgrensning for 2025 oppgir tettstedet Kristiansand til 24,4 kvadratkilometer og om lag 67 900 innbyggere.",
      "sourceUrl": "https://snl.no/Kristiansand_-_tettsted",
      "sourceLocation": "Faktaboks og ingress",
      "sourceType": "reputable_secondary",
      "verifiedAt": "2026-08-19",
      "status": "verified",
      "claimKind": "ordinary",
      "evidenceMode": "explicit",
      "temporalStatus": "current"
    },
    {
      "id": "claim_kristiansand_3",
      "claim": "Bysenteret i Kristiansand ligger på vestsiden av munningen av Otra, med Kvadraturen og fjorden som sentrale deler av det urbane området.",
      "sourceUrl": "https://snl.no/Kristiansand",
      "sourceLocation": "Ingress og kartbeskrivelse",
      "sourceType": "reputable_secondary",
      "verifiedAt": "2026-08-19",
      "status": "verified",
      "claimKind": "ordinary",
      "evidenceMode": "explicit"
    },
    {
      "id": "claim_kristiansand_4",
      "claim": "Kristiansand er administrasjonssenter i kommunen, som strekker seg langs kysten og inn i dalførene omkring Otra, Tovdalselva og Søgneelva.",
      "sourceUrl": "https://snl.no/Kristiansand",
      "sourceLocation": "Faktaboks og ingress",
      "sourceType": "reputable_secondary",
      "verifiedAt": "2026-08-19",
      "status": "verified",
      "claimKind": "ordinary",
      "evidenceMode": "explicit"
    },
    {
      "id": "claim_kristiansand_5",
      "claim": "Kristiansand kommune rommer flere tettsteder, slik at den statistiske tettstedsgrensen og kommunegrensen beskriver forskjellige geografiske nivåer.",
      "sourceUrl": "https://snl.no/Kristiansand",
      "sourceLocation": "Avsnitt om bosetning",
      "sourceType": "reputable_secondary",
      "verifiedAt": "2026-08-19",
      "status": "verified",
      "claimKind": "ordinary",
      "evidenceMode": "explicit"
    }
  ],
  "sentenceCoverage": {
    "desc": [
      {
        "sentence": 1,
        "claimIds": [
          "claim_kristiansand_1"
        ]
      },
      {
        "sentence": 2,
        "claimIds": [
          "claim_kristiansand_2"
        ]
      }
    ],
    "popupDesc": [
      {
        "sentence": 1,
        "claimIds": [
          "claim_kristiansand_1"
        ]
      },
      {
        "sentence": 2,
        "claimIds": [
          "claim_kristiansand_2"
        ]
      },
      {
        "sentence": 3,
        "claimIds": [
          "claim_kristiansand_3"
        ]
      },
      {
        "sentence": 4,
        "claimIds": [
          "claim_kristiansand_4"
        ]
      },
      {
        "sentence": 5,
        "claimIds": [
          "claim_kristiansand_5"
        ]
      }
    ]
  },
  "reviews": {
    "factual": {
      "status": "passed",
      "reviewedAt": "2026-08-19",
      "reviewer": "History Go kildekontroll – documented coverage"
    },
    "editorial": {
      "status": "passed",
      "reviewedAt": "2026-08-19",
      "reviewer": "History Go redaksjonell kontroll – documented coverage",
      "introducedNewFacts": false
    }
  },
  "quizReadiness": {
    "questions": []
  },
  "completion": {
    "completedUnder": "4.2",
    "currentStatus": "current",
    "sourceVerifiedAt": "2026-08-19",
    "claimsVerified": {
      "verified": 5,
      "total": 5
    },
    "factualReview": "passed",
    "editorialReview": "passed",
    "validatorVersion": "4.2.1"
  },
  "reviewsNotes": "Kort områdebeskrivelse og Språkatlas-kobling er kildekontrollert. Full ordinær Place Description v4.2-research er bevisst ikke påstått i denne produktdekningsrunden."
}
