{
  "schemaVersion": "4.2",
  "validatorVersion": "4.2.1",
  "placeId": "sofienbergparken_gjenvinningsstasjon",
  "placeFile": "data/places/natur/oslo/miljo_gjenbruk/sofienbergparken_gjenvinningsstasjon.json",
  "status": "ready_v4_2",
  "identity": {
    "status": "resolved",
    "represents": "Sofienbergparken gjenvinningsstasjon som eget kommunalt ombruks- eller gjenvinningstilbud ved Helgesens gate 56, 0553 Oslo.",
    "period": "2026–",
    "excludes": [
      "andre kommunale gjenvinningsstasjoner",
      "mobile eller midlertidige tilbud",
      "nabosteder uten samme tjenesteidentitet"
    ]
  },
  "metadataSnapshot": {
    "name": "Sofienbergparken gjenvinningsstasjon",
    "category": "natur"
  },
  "textHashes": {
    "algorithm": "sha256",
    "desc": "08d4947ff8b014294dd6631904421a2425e7455b067d90b17ae583393b9bef0d",
    "popupDesc": "f113ea6a50edfaebb729878ffa29ff76b65b9bdbeb0d2213ee589539e5d2fc9f"
  },
  "claims": [
    {
      "id": "claim_sofienbergparken_gjenvinningsstasjon_identity",
      "claim": "Sofienbergparken gjenvinningsstasjon er Oslo kommunes aktive ombruks- eller gjenvinningstilbud ved Helgesens gate 56, 0553 Oslo.",
      "sourceUrl": "https://www.oslo.kommune.no/avfall-og-gjenvinning/alle-gjenvinningsstasjoner/sofienbergparken-gjenvinningsstasjon/",
      "sourceLocation": "Kommunal stedsside: navn, plassering og tjeneste.",
      "sourceType": "institutional",
      "verifiedAt": "2026-08-26",
      "status": "verified",
      "claimKind": "identity",
      "evidenceMode": "direct",
      "temporalStatus": "current"
    },
    {
      "id": "claim_sofienbergparken_gjenvinningsstasjon_reuse",
      "claim": "Stasjonen inngår blant de små gangbaserte stasjonene der mindre ombruksvarer kan hentes uten betaling.",
      "sourceUrl": "https://www.oslo.kommune.no/avfall-og-gjenvinning/alle-gjenvinningsstasjoner/sofienbergparken-gjenvinningsstasjon/",
      "sourceLocation": "Kommunal stedsside og ombruksside: uttak, salg og praktisk ombruksfunksjon.",
      "sourceType": "institutional",
      "verifiedAt": "2026-08-26",
      "status": "verified",
      "claimKind": "ordinary",
      "evidenceMode": "direct",
      "temporalStatus": "current"
    },
    {
      "id": "claim_sofienbergparken_gjenvinningsstasjon_network",
      "claim": "Sofienbergparken gjenvinningsstasjon er del av kommunens ombruks- og gjenvinningsnettverk i Oslo.",
      "sourceUrl": "https://www.oslo.kommune.no/avfall-og-gjenvinning/ombruk/",
      "sourceLocation": "Hente eller levere til ombruk: uttakssteder og ombruksløsninger.",
      "sourceType": "institutional",
      "verifiedAt": "2026-08-26",
      "status": "verified",
      "claimKind": "ordinary",
      "evidenceMode": "direct",
      "temporalStatus": "current"
    },
    {
      "id": "claim_sofienbergparken_gjenvinningsstasjon_access",
      "claim": "Praktiske vilkår og tilgjengelighet ved Sofienbergparken gjenvinningsstasjon kan endres og må kontrolleres på den kommunale stedssiden.",
      "sourceUrl": "https://www.oslo.kommune.no/avfall-og-gjenvinning/alle-gjenvinningsstasjoner/sofienbergparken-gjenvinningsstasjon/",
      "sourceLocation": "Kommunal stedsside: praktiske vilkår og aktuell tilgjengelighet.",
      "sourceType": "institutional",
      "verifiedAt": "2026-08-26",
      "status": "verified",
      "claimKind": "temporal",
      "evidenceMode": "direct",
      "temporalStatus": "current"
    },
    {
      "id": "claim_sofienbergparken_gjenvinningsstasjon_circular",
      "claim": "Ombruksfunksjonen ved Sofienbergparken gjenvinningsstasjon viser avfallshierarkiets prioritering av videre bruk før materialgjenvinning når det er forsvarlig.",
      "sourceUrl": "https://www.miljodirektoratet.no/ansvarsomrader/avfall/sirkular-okonomi/",
      "sourceLocation": "Miljødirektoratets fagstoff om sirkulær økonomi og avfallshierarki.",
      "sourceType": "official",
      "verifiedAt": "2026-08-26",
      "status": "verified",
      "claimKind": "ordinary",
      "evidenceMode": "direct",
      "temporalStatus": "current"
    }
  ],
  "sentenceCoverage": {
    "desc": [
      {
        "sentence": 1,
        "claimIds": [
          "claim_sofienbergparken_gjenvinningsstasjon_identity"
        ]
      },
      {
        "sentence": 2,
        "claimIds": [
          "claim_sofienbergparken_gjenvinningsstasjon_reuse"
        ]
      },
      {
        "sentence": 3,
        "claimIds": [
          "claim_sofienbergparken_gjenvinningsstasjon_network"
        ]
      }
    ],
    "popupDesc": [
      {
        "sentence": 1,
        "claimIds": [
          "claim_sofienbergparken_gjenvinningsstasjon_identity"
        ]
      },
      {
        "sentence": 2,
        "claimIds": [
          "claim_sofienbergparken_gjenvinningsstasjon_reuse"
        ]
      },
      {
        "sentence": 3,
        "claimIds": [
          "claim_sofienbergparken_gjenvinningsstasjon_access"
        ]
      },
      {
        "sentence": 4,
        "claimIds": [
          "claim_sofienbergparken_gjenvinningsstasjon_circular"
        ]
      }
    ]
  },
  "reviews": {
    "factual": {
      "status": "passed",
      "reviewedAt": "2026-08-26",
      "reviewer": "History GO independent source and place-specificity audit"
    },
    "editorial": {
      "status": "passed",
      "reviewedAt": "2026-08-26",
      "reviewer": "History GO independent source and place-specificity audit",
      "introducedNewFacts": false
    }
  },
  "quizReadiness": {
    "questions": []
  },
  "completion": {
    "completedUnder": "4.2",
    "currentStatus": "current",
    "sourceVerifiedAt": "2026-08-26",
    "claimsVerified": {
      "verified": 5,
      "total": 5
    },
    "factualReview": "passed",
    "editorialReview": "passed",
    "validatorVersion": "4.2.1"
  }
}
