{
  "schemaVersion": "4.2",
  "validatorVersion": "4.2.1",
  "placeId": "bla_skilt_inger_sitter_president_harbitz_gate_19b",
  "placeFile": "data/places/kunst/oslo/bla_skilt/bla_skilt_inger_sitter_president_harbitz_gate_19b.json",
  "status": "ready_v4_2",
  "identity": {
    "status": "resolved",
    "represents": "Blått skilt: Inger Sitter som eget fysisk offentlig minneskilt ved President Harbitz' gate 19B, 0259, OSLO.",
    "period": "aktivt offentlig minneskilt",
    "excludes": [
      "personen eller institusjonen som abstrakt emne",
      "privat interiør på adressen",
      "andre blå skilt i nærheten"
    ]
  },
  "metadataSnapshot": {
    "name": "Blått skilt: Inger Sitter",
    "category": "kunst"
  },
  "textHashes": {
    "algorithm": "sha256",
    "desc": "9d033883641a55847e76ad2d98a79670313fe4e57ab014f20bcfd10c5b522660",
    "popupDesc": "25d3441f87111e54c06d8c124c813b3129c2a4c5747baadf7b26bfa9cdb3c727"
  },
  "claims": [
    {
      "id": "claim_bla_skilt_inger_sitter_president_harbitz_gate_19b_identity",
      "claim": "Oslo Byes Vels blå-skiltprogram knytter Blått skilt: Inger Sitter til President Harbitz' gate 19B, 0259, OSLO.",
      "sourceUrl": "https://www.oslobyesvel.no/nyheter/inger-sitter-hedret-med-bltt-skilt/10",
      "sourceLocation": "Oslo Byes Vel: skiltets identitet og sted.",
      "sourceType": "official",
      "verifiedAt": "2026-08-26",
      "status": "verified",
      "claimKind": "identity",
      "evidenceMode": "direct",
      "temporalStatus": "current"
    },
    {
      "id": "claim_bla_skilt_inger_sitter_president_harbitz_gate_19b_listing",
      "claim": "Oslo Byes Vel avduket skiltet 20. oktober 2025 ved hjemmet der Inger Sitter bodde fra 1965 til 1990.",
      "sourceUrl": "https://www.oslobyesvel.no/nyheter/inger-sitter-hedret-med-bltt-skilt/10",
      "sourceLocation": "Oslo Byes Vel eller dokumentert lokal skiltkilde: fysisk skilt og adresse.",
      "sourceType": "official",
      "verifiedAt": "2026-08-26",
      "status": "verified",
      "claimKind": "ordinary",
      "evidenceMode": "direct",
      "temporalStatus": "historical"
    },
    {
      "id": "claim_bla_skilt_inger_sitter_president_harbitz_gate_19b_context",
      "claim": "Sitter arbeidet som modernist og ble professor ved Kunstakademiet i 1981.",
      "sourceUrl": "https://www.oslobyesvel.no/nyheter/inger-sitter-hedret-med-bltt-skilt/10",
      "sourceLocation": "Kildeavsnitt om personen, virksomheten, hendelsen eller stedet som skiltet markerer.",
      "sourceType": "official",
      "verifiedAt": "2026-08-26",
      "status": "verified",
      "claimKind": "ordinary",
      "evidenceMode": "direct",
      "temporalStatus": "historical"
    },
    {
      "id": "claim_bla_skilt_inger_sitter_president_harbitz_gate_19b_coordinate",
      "claim": "Kartmarkøren bruker Kartverkets offisielle adresserepresentasjonspunkt for President Harbitz' gate 19B, 0259, OSLO.",
      "sourceUrl": "https://ws.geonorge.no/adresser/v1/",
      "sourceLocation": "Geonorge Adresser API: representasjonspunkt for adressen.",
      "sourceType": "official",
      "verifiedAt": "2026-08-26",
      "status": "verified",
      "claimKind": "ordinary",
      "evidenceMode": "direct",
      "temporalStatus": "current"
    }
  ],
  "sentenceCoverage": {
    "desc": [
      {
        "sentence": 1,
        "claimIds": [
          "claim_bla_skilt_inger_sitter_president_harbitz_gate_19b_identity"
        ]
      },
      {
        "sentence": 2,
        "claimIds": [
          "claim_bla_skilt_inger_sitter_president_harbitz_gate_19b_listing"
        ]
      },
      {
        "sentence": 3,
        "claimIds": [
          "claim_bla_skilt_inger_sitter_president_harbitz_gate_19b_context"
        ]
      }
    ],
    "popupDesc": [
      {
        "sentence": 1,
        "claimIds": [
          "claim_bla_skilt_inger_sitter_president_harbitz_gate_19b_identity"
        ]
      },
      {
        "sentence": 2,
        "claimIds": [
          "claim_bla_skilt_inger_sitter_president_harbitz_gate_19b_listing"
        ]
      },
      {
        "sentence": 3,
        "claimIds": [
          "claim_bla_skilt_inger_sitter_president_harbitz_gate_19b_context"
        ]
      },
      {
        "sentence": 4,
        "claimIds": [
          "claim_bla_skilt_inger_sitter_president_harbitz_gate_19b_coordinate"
        ]
      }
    ]
  },
  "reviews": {
    "factual": {
      "status": "passed",
      "reviewedAt": "2026-08-26",
      "reviewer": "History GO blue-sign phase 2 source audit"
    },
    "editorial": {
      "status": "passed",
      "reviewedAt": "2026-08-26",
      "reviewer": "History GO blue-sign phase 2 editorial audit",
      "introducedNewFacts": false
    }
  },
  "quizReadiness": {
    "questions": []
  },
  "completion": {
    "completedUnder": "4.2",
    "currentStatus": "current",
    "sourceVerifiedAt": "2026-08-26",
    "claimsVerified": {
      "verified": 4,
      "total": 4
    },
    "factualReview": "passed",
    "editorialReview": "passed",
    "validatorVersion": "4.2.1"
  }
}
